{
  "report_schema_version": 1,
  "protocol_version": 2,
  "test_id": "ffeeddccbbaa99887766554433221100",
  "status": "COMPLETED",
  "started_at": "2026-09-24T18:02:00Z",
  "ended_at": "2026-09-24T18:02:01Z",
  "environment": {
    "connection_type": "wifi",
    "probe_id": "local-1",
    "probe_region": "local",
    "udp_port": 16384,
    "agent_version": "0.1.0"
  },
  "profile": {
    "name": "udp-baseline-v1",
    "payload_bytes": 172,
    "target_packet_rate": 4,
    "measurement_duration_ms": 1000
  },
  "upstream": {
    "observer": "probe",
    "packets_sent": 4,
    "packets_received": 4,
    "duplicates": 0,
    "out_of_order": 0,
    "loss_pct": 0.0,
    "jitter_ms_p50": 3.0,
    "jitter_ms_p95": 12.0,
    "throughput_kbps": 5.504
  },
  "downstream": {
    "observer": "agent",
    "packets_sent": 4,
    "packets_received": 4,
    "duplicates": 0,
    "out_of_order": 0,
    "loss_pct": 0.0,
    "jitter_ms_p50": 18.0,
    "jitter_ms_p95": 65.0,
    "throughput_kbps": 5.504
  },
  "rtt_ms": { "min": 18.0, "mean": 35.0, "p95": 90.0 },
  "reachability": { "protocol": "udp", "port": 16384, "status": "bidirectional" }
}
